{
  "bit_width": 72,
  "distribution_id": "spatial_hot_spots-72bit-seed5206-v1",
  "normalization": {
    "probability_sum": 1.0,
    "tolerance": 1e-12,
    "valid": true
  },
  "patterns": [
    {
      "family": "sbu",
      "metadata": {
        "component_families": [
          "sbu"
        ]
      },
      "pattern_id": "spatial_hot_spots-0000",
      "positions": [
        0
      ],
      "probability": 0.004861111111111111
    },
    {
      "family": "sbu",
      "metadata": {
        "component_families": [
          "sbu"
        ]
      },
      "pattern_id": "spatial_hot_spots-0001",
      "positions": [
        1
      ],
      "probability": 0.004861111111111111
    },
    {
      "family": "sbu",
      "metadata": {
        "component_families": [
          "sbu"
        ]
      },
      "pattern_id": "spatial_hot_spots-0002",
      "positions": [
        2
      ],
      "probability": 0.004861111111111111
    },
    {
      "family": "sbu",
      "metadata": {
        "component_families": [
          "sbu"
        ]
      },
      "pattern_id": "spatial_hot_spots-0003",
      "positions": [
        3
      ],
      "probability": 0.004861111111111111
    },
    {
      "family": "sbu",
      "metadata": {
        "component_families": [
          "sbu"
        ]
      },
      "pattern_id": "spatial_hot_spots-0004",
      "positions": [
        4
      ],
      "probability": 0.004861111111111111
    },
    {
      "family": "sbu",
      "metadata": {
        "component_families": [
          "sbu"
        ]
      },
      "pattern_id": "spatial_hot_spots-0005",
      "positions": [
        5
      ],
      "probability": 0.004861111111111111
    },
    {
      "family": "sbu",
      "metadata": {
        "component_families": [
          "sbu"
        ]
      },
      "pattern_id": "spatial_hot_spots-0006",
      "positions": [
        6
      ],
      "probability": 0.004861111111111111
    },
    {
      "family": "sbu",
      "metadata": {
        "component_families": [
          "sbu"
        ]
      },
      "pattern_id": "spatial_hot_spots-0007",
      "positions": [
        7
      ],
      "probability": 0.004861111111111111
    },
    {
      "family": "sbu",
      "metadata": {
        "component_families": [
          "sbu"
        ]
      },
      "pattern_id": "spatial_hot_spots-0008",
      "positions": [
        8
      ],
      "probability": 0.004861111111111111
    },
    {
      "family": "sbu",
      "metadata": {
        "component_families": [
          "sbu"
        ]
      },
      "pattern_id": "spatial_hot_spots-0009",
      "positions": [
        9
      ],
      "probability": 0.004861111111111111
    },
    {
      "family": "sbu",
      "metadata": {
        "component_families": [
          "sbu"
        ]
      },
      "pattern_id": "spatial_hot_spots-0010",
      "positions": [
        10
      ],
      "probability": 0.004861111111111111
    },
    {
      "family": "sbu",
      "metadata": {
        "component_families": [
          "sbu"
        ]
      },
      "pattern_id": "spatial_hot_spots-0011",
      "positions": [
        11
      ],
      "probability": 0.004861111111111111
    },
    {
      "family": "sbu",
      "metadata": {
        "component_families": [
          "sbu"
        ]
      },
      "pattern_id": "spatial_hot_spots-0012",
      "positions": [
        12
      ],
      "probability": 0.004861111111111111
    },
    {
      "family": "sbu",
      "metadata": {
        "component_families": [
          "sbu"
        ]
      },
      "pattern_id": "spatial_hot_spots-0013",
      "positions": [
        13
      ],
      "probability": 0.004861111111111111
    },
    {
      "family": "sbu",
      "metadata": {
        "component_families": [
          "sbu"
        ]
      },
      "pattern_id": "spatial_hot_spots-0014",
      "positions": [
        14
      ],
      "probability": 0.004861111111111111
    },
    {
      "family": "sbu",
      "metadata": {
        "component_families": [
          "sbu"
        ]
      },
      "pattern_id": "spatial_hot_spots-0015",
      "positions": [
        15
      ],
      "probability": 0.004861111111111111
    },
    {
      "family": "sbu",
      "metadata": {
        "component_families": [
          "sbu"
        ]
      },
      "pattern_id": "spatial_hot_spots-0016",
      "positions": [
        16
      ],
      "probability": 0.004861111111111111
    },
    {
      "family": "sbu",
      "metadata": {
        "component_families": [
          "sbu"
        ]
      },
      "pattern_id": "spatial_hot_spots-0017",
      "positions": [
        17
      ],
      "probability": 0.004861111111111111
    },
    {
      "family": "sbu",
      "metadata": {
        "component_families": [
          "sbu"
        ]
      },
      "pattern_id": "spatial_hot_spots-0018",
      "positions": [
        18
      ],
      "probability": 0.004861111111111111
    },
    {
      "family": "sbu",
      "metadata": {
        "component_families": [
          "sbu"
        ]
      },
      "pattern_id": "spatial_hot_spots-0019",
      "positions": [
        19
      ],
      "probability": 0.004861111111111111
    },
    {
      "family": "sbu",
      "metadata": {
        "component_families": [
          "sbu"
        ]
      },
      "pattern_id": "spatial_hot_spots-0020",
      "positions": [
        20
      ],
      "probability": 0.004861111111111111
    },
    {
      "family": "sbu",
      "metadata": {
        "component_families": [
          "sbu"
        ]
      },
      "pattern_id": "spatial_hot_spots-0021",
      "positions": [
        21
      ],
      "probability": 0.004861111111111111
    },
    {
      "family": "sbu",
      "metadata": {
        "component_families": [
          "sbu"
        ]
      },
      "pattern_id": "spatial_hot_spots-0022",
      "positions": [
        22
      ],
      "probability": 0.004861111111111111
    },
    {
      "family": "sbu",
      "metadata": {
        "component_families": [
          "sbu"
        ]
      },
      "pattern_id": "spatial_hot_spots-0023",
      "positions": [
        23
      ],
      "probability": 0.004861111111111111
    },
    {
      "family": "sbu",
      "metadata": {
        "component_families": [
          "sbu"
        ]
      },
      "pattern_id": "spatial_hot_spots-0024",
      "positions": [
        24
      ],
      "probability": 0.004861111111111111
    },
    {
      "family": "sbu",
      "metadata": {
        "component_families": [
          "sbu"
        ]
      },
      "pattern_id": "spatial_hot_spots-0025",
      "positions": [
        25
      ],
      "probability": 0.004861111111111111
    },
    {
      "family": "sbu",
      "metadata": {
        "component_families": [
          "sbu"
        ]
      },
      "pattern_id": "spatial_hot_spots-0026",
      "positions": [
        26
      ],
      "probability": 0.004861111111111111
    },
    {
      "family": "sbu",
      "metadata": {
        "component_families": [
          "sbu"
        ]
      },
      "pattern_id": "spatial_hot_spots-0027",
      "positions": [
        27
      ],
      "probability": 0.004861111111111111
    },
    {
      "family": "sbu",
      "metadata": {
        "component_families": [
          "sbu"
        ]
      },
      "pattern_id": "spatial_hot_spots-0028",
      "positions": [
        28
      ],
      "probability": 0.004861111111111111
    },
    {
      "family": "sbu",
      "metadata": {
        "component_families": [
          "sbu"
        ]
      },
      "pattern_id": "spatial_hot_spots-0029",
      "positions": [
        29
      ],
      "probability": 0.004861111111111111
    },
    {
      "family": "sbu",
      "metadata": {
        "component_families": [
          "sbu"
        ]
      },
      "pattern_id": "spatial_hot_spots-0030",
      "positions": [
        30
      ],
      "probability": 0.004861111111111111
    },
    {
      "family": "sbu",
      "metadata": {
        "component_families": [
          "sbu"
        ]
      },
      "pattern_id": "spatial_hot_spots-0031",
      "positions": [
        31
      ],
      "probability": 0.004861111111111111
    },
    {
      "family": "sbu",
      "metadata": {
        "component_families": [
          "sbu"
        ]
      },
      "pattern_id": "spatial_hot_spots-0032",
      "positions": [
        32
      ],
      "probability": 0.004861111111111111
    },
    {
      "family": "sbu",
      "metadata": {
        "component_families": [
          "sbu"
        ]
      },
      "pattern_id": "spatial_hot_spots-0033",
      "positions": [
        33
      ],
      "probability": 0.004861111111111111
    },
    {
      "family": "sbu",
      "metadata": {
        "component_families": [
          "sbu"
        ]
      },
      "pattern_id": "spatial_hot_spots-0034",
      "positions": [
        34
      ],
      "probability": 0.004861111111111111
    },
    {
      "family": "sbu",
      "metadata": {
        "component_families": [
          "sbu"
        ]
      },
      "pattern_id": "spatial_hot_spots-0035",
      "positions": [
        35
      ],
      "probability": 0.004861111111111111
    },
    {
      "family": "sbu",
      "metadata": {
        "component_families": [
          "sbu"
        ]
      },
      "pattern_id": "spatial_hot_spots-0036",
      "positions": [
        36
      ],
      "probability": 0.004861111111111111
    },
    {
      "family": "sbu",
      "metadata": {
        "component_families": [
          "sbu"
        ]
      },
      "pattern_id": "spatial_hot_spots-0037",
      "positions": [
        37
      ],
      "probability": 0.004861111111111111
    },
    {
      "family": "sbu",
      "metadata": {
        "component_families": [
          "sbu"
        ]
      },
      "pattern_id": "spatial_hot_spots-0038",
      "positions": [
        38
      ],